{
  "table": "odds.rngscore",
  "schemaVersion": 1,
  "dataVersion": 1,
  "gameVersion": "0.27.1",
  "generatedAt": "2026-10-09T19:59:30Z",
  "license": "MIT",
  "sources": {
    "neu": {
      "title": "NEU-REPO constants/rngscore.json (meter scores) and items/*.json (display names)",
      "url": "https://github.com/NotEnoughUpdates/NotEnoughUpdates-REPO",
      "revision": "c4f7d4757641f3a11c74d3d77cec76c100abaf98",
      "license": "MIT",
      "notice": "neu-repo",
      "access": "git"
    }
  },
  "rows": [
    {
      "id": "catacombs:F1:BONZO_STAFF",
      "case": "catacombs",
      "group": "F1",
      "item": "BONZO_STAFF",
      "displayName": "Bonzo's Staff",
      "score": 31800,
      "sourceRefs": [
        "neu"
      ],
      "license": "MIT",
      "verified": true,
      "gameVersion": "0.27.1"
    },
    {
      "id": "catacombs:F1:ULTIMATE_JERRY;1",
      "case": "catacombs",
      "group": "F1",
      "item": "ULTIMATE_JERRY;1",
      "displayName": "Ultimate Jerry I",
      "score": 31800,
      "sourceRefs": [
        "neu"
      ],
      "license": "MIT",
      "verified": true,
      "gameVersion": "0.27.1"
    },
    {
      "id": "catacombs:F1:FUMING_POTATO_BOOK",
      "case": "catacombs",
      "group": "F1",
      "item": "FUMING_POTATO_BOOK",
      "displayName": "Fuming Potato Book",
      "score": 15900,
      "sourceRefs": [
        "neu"
      ],
      "license": "MIT",
      "verified": true,
      "gameVersion": "0.27.1"
    },
    {
      "id": "catacombs:F1:ULTIMATE_BANK;1",
      "case": "catacombs",
      "group": "F1",
      "item": "ULTIMATE_BANK;1",
      "displayName": "Bank I",
      "score": 15900,
      "sourceRefs": [
        "neu"
      ],
      "license": "MIT",
      "verified": true,
      "gameVersion": "0.27.1"
    },
    {
      "id": "catacombs:F1:RECOMBOBULATOR_3000",
      "case": "catacombs",
      "group": "F1",
      "item": "RECOMBOBULATOR_3000",
      "displayName": "Recombobulator 3000",
      "score": 10599,
      "sourceRefs": [
        "neu"
      ],
      "license": "MIT",
      "verified": true,
      "gameVersion": "0.27.1"
    },
    {
      "id": "catacombs:F1:BONZO_MASK",
      "case": "catacombs",
      "group": "F1",
      "item": "BONZO_MASK",
      "displayName": "Bonzo's Mask",
      "score": 10599,
      "sourceRefs": [
        "neu"
      ],
      "license": "MIT",
      "verified": true,
      "gameVersion": "0.27.1"
    },
    {
      "id": "catacombs:F1:RED_NOSE",
      "case": "catacombs",
      "group": "F1",
      "item": "RED_NOSE",
      "displayName": "Red Nose",
      "score": 10599,
      "sourceRefs": [
        "neu"
      ],
      "license": "MIT",
      "verified": true,
      "gameVersion": "0.27.1"
    },
    {
      "id": "catacombs:F1:BALLOON_SNAKE",
      "case": "catacombs",
      "group": "F1",
      "item": "BALLOON_SNAKE",
      "displayName": "Balloon Snake",
      "score": 7950,
      "sourceRefs": [
        "neu"
      ],
      "license": "MIT",
      "verified": true,
      "gameVersion": "0.27.1"
    },
    {
      "id": "catacombs:F1:HOT_POTATO_BOOK",
      "case": "catacombs",
      "group": "F1",
      "item": "HOT_POTATO_BOOK",
      "displayName": "Hot Potato Book",
      "score": 6360,
      "sourceRefs": [
        "neu"
      ],
      "license": "MIT",
      "verified": true,
      "gameVersion": "0.27.1"
    },
    {
      "id": "catacombs:F1:INFINITE_QUIVER;6",
      "case": "catacombs",
      "group": "F1",
      "item": "INFINITE_QUIVER;6",
      "displayName": "Infinite Quiver VI",
      "score": 3975,
      "sourceRefs": [
        "neu"
      ],
      "license": "MIT",
      "verified": true,
      "gameVersion": "0.27.1"
    },
    {
      "id": "catacombs:F1:FEATHER_FALLING;6",
      "case": "catacombs",
      "group": "F1",
      "item": "FEATHER_FALLING;6",
      "displayName": "Feather Falling VI",
      "score": 3975,
      "sourceRefs": [
        "neu"
      ],
      "license": "MIT",
      "verified": true,
      "gameVersion": "0.27.1"
    },
    {
      "id": "catacombs:F1:NECROMANCER_BROOCH",
      "case": "catacombs",
      "group": "F1",
      "item": "NECROMANCER_BROOCH",
      "displayName": "Necromancer's Brooch",
      "score": 3180,
      "sourceRefs": [
        "neu"
      ],
      "license": "MIT",
      "verified": true,
      "gameVersion": "0.27.1"
    },
    {
      "id": "catacombs:F1:ULTIMATE_COMBO;1",
      "case": "catacombs",
      "group": "F1",
      "item": "ULTIMATE_COMBO;1",
      "displayName": "Combo I",
      "score": 2120,
      "sourceRefs": [
        "neu"
      ],
      "license": "MIT",
      "verified": true,
      "gameVersion": "0.27.1"
    },
    {
      "id": "catacombs:F1:ULTIMATE_NO_PAIN_NO_GAIN;1",
      "case": "catacombs",
      "group": "F1",
      "item": "ULTIMATE_NO_PAIN_NO_GAIN;1",
      "displayName": "No Pain No Gain I",
      "score": 2120,
      "sourceRefs": [
        "neu"
      ],
      "license": "MIT",
      "verified": true,
      "gameVersion": "0.27.1"
    },
    {
      "id": "catacombs:F1:REJUVENATE;1",
      "case": "catacombs",
      "group": "F1",
      "item": "REJUVENATE;1",
      "displayName": "Rejuvenate I",
      "score": 1272,
      "sourceRefs": [
        "neu"
      ],
      "license": "MIT",
      "verified": true,
      "gameVersion": "0.27.1"
    },
    {
      "id": "catacombs:F2:RED_SCARF",
      "case": "catacombs",
      "group": "F2",
      "item": "RED_SCARF",
      "displayName": "Red Scarf",
      "score": 18900,
      "sourceRefs": [
        "neu"
      ],
      "license": "MIT",
      "verified": true,
      "gameVersion": "0.27.1"
    },
    {
      "id": "catacombs:F2:RECOMBOBULATOR_3000",
      "case": "catacombs",
      "group": "F2",
      "item": "RECOMBOBULATOR_3000",
      "displayName": "Recombobulator 3000",
      "score": 9450,
      "sourceRefs": [
        "neu"
      ],
      "license": "MIT",
      "verified": true,
      "gameVersion": "0.27.1"
    },
    {
      "id": "catacombs:F2:STONE_BLADE",
      "case": "catacombs",
      "group": "F2",
      "item": "STONE_BLADE",
      "displayName": "Adaptive Blade",
      "score": 9450,
      "sourceRefs": [
        "neu"
      ],
      "license": "MIT",
      "verified": true,
      "gameVersion": "0.27.1"
    },
    {
      "id": "catacombs:F2:ULTIMATE_BANK;1",
      "case": "catacombs",
      "group": "F2",
      "item": "ULTIMATE_BANK;1",
      "displayName": "Bank I",
      "score": 9450,
      "sourceRefs": [
        "neu"
      ],
      "license": "MIT",
      "verified": true,
      "gameVersion": "0.27.1"
    },
    {
      "id": "catacombs:F2:ADAPTIVE_BELT",
      "case": "catacombs",
      "group": "F2",
      "item": "ADAPTIVE_BELT",
      "displayName": "Adaptive Belt",
      "score": 6300,
      "sourceRefs": [
        "neu"
      ],
      "license": "MIT",
      "verified": true,
      "gameVersion": "0.27.1"
    },
    {
      "id": "catacombs:F2:FUMING_POTATO_BOOK",
      "case": "catacombs",
      "group": "F2",
      "item": "FUMING_POTATO_BOOK",
      "displayName": "Fuming Potato Book",
      "score": 6300,
      "sourceRefs": [
        "neu"
      ],
      "license": "MIT",
      "verified": true,
      "gameVersion": "0.27.1"
    },
    {
      "id": "catacombs:F2:SCARF_STUDIES",
      "case": "catacombs",
      "group": "F2",
      "item": "SCARF_STUDIES",
      "displayName": "Scarf's Studies",
      "score": 4725,
      "sourceRefs": [
        "neu"
      ],
      "license": "MIT",
      "verified": true,
      "gameVersion": "0.27.1"
    },
    {
      "id": "catacombs:F2:HOT_POTATO_BOOK",
      "case": "catacombs",
      "group": "F2",
      "item": "HOT_POTATO_BOOK",
      "displayName": "Hot Potato Book",
      "score": 3780,
      "sourceRefs": [
        "neu"
      ],
      "license": "MIT",
      "verified": true,
      "gameVersion": "0.27.1"
    },
    {
      "id": "catacombs:F2:ULTIMATE_COMBO;1",
      "case": "catacombs",
      "group": "F2",
      "item": "ULTIMATE_COMBO;1",
      "displayName": "Combo I",
      "score": 3780,
      "sourceRefs": [
        "neu"
      ],
      "license": "MIT",
      "verified": true,
      "gameVersion": "0.27.1"
    },
    {
      "id": "catacombs:F2:ULTIMATE_NO_PAIN_NO_GAIN;1",
      "case": "catacombs",
      "group": "F2",
      "item": "ULTIMATE_NO_PAIN_NO_GAIN;1",
      "displayName": "No Pain No Gain I",
      "score": 3780,
      "sourceRefs": [
        "neu"
      ],
      "license": "MIT",
      "verified": true,
      "gameVersion": "0.27.1"
    },
    {
      "id": "catacombs:F2:NECROMANCER_BROOCH",
      "case": "catacombs",
      "group": "F2",
      "item": "NECROMANCER_BROOCH",
      "displayName": "Necromancer's Brooch",
      "score": 3780,
      "sourceRefs": [
        "neu"
      ],
      "license": "MIT",
      "verified": true,
      "gameVersion": "0.27.1"
    },
    {
      "id": "catacombs:F2:ULTIMATE_WISE;1",
      "case": "catacombs",
      "group": "F2",
      "item": "ULTIMATE_WISE;1",
      "displayName": "Ultimate Wise I",
      "score": 1890,
      "sourceRefs": [
        "neu"
      ],
      "license": "MIT",
      "verified": true,
      "gameVersion": "0.27.1"
    },
    {
      "id": "catacombs:F2:REJUVENATE;1",
      "case": "catacombs",
      "group": "F2",
      "item": "REJUVENATE;1",
      "displayName": "Rejuvenate I",
      "score": 1260,
      "sourceRefs": [
        "neu"
      ],
      "license": "MIT",
      "verified": true,
      "gameVersion": "0.27.1"
    },
    {
      "id": "catacombs:F3:ADAPTIVE_CHESTPLATE",
      "case": "catacombs",
      "group": "F3",
      "item": "ADAPTIVE_CHESTPLATE",
      "displayName": "Adaptive Chestplate",
      "score": 26100,
      "sourceRefs": [
        "neu"
      ],
      "license": "MIT",
      "verified": true,
      "gameVersion": "0.27.1"
    },
    {
      "id": "catacombs:F3:ADAPTIVE_LEGGINGS",
      "case": "catacombs",
      "group": "F3",